{"currency":{"hacksilver":7931},"expedition":null,"format":"three-realms-save","heroes":[{"class":"shieldwarden","id":5,"injury":0,"level":30,"name":"Leif","runbook":{"rules":[{"do":{"a":"skill","skill":"hold_the_line"},"target":null,"when":[{"c":"self_hp_below","pct":50}]},{"do":{"a":"skill","skill":"shield_bash"},"target":"highest_hp","when":[{"c":"always"}]}],"v":1},"slots":{"armour":112,"charm":159,"helm":72,"weapon":160},"thread":true,"xp":2060},{"class":"huscarl","id":10,"injury":0,"level":24,"name":"Gunnar","runbook":{"rules":[{"do":{"a":"skill","skill":"cleave"},"target":null,"when":[{"c":"enemies_at_least","n":3}]},{"do":{"a":"skill","skill":"hearth_strike"},"target":"lowest_hp_pct","when":[{"c":"always"}]}],"v":1},"slots":{"armour":25,"charm":45,"helm":8,"weapon":43},"thread":false,"xp":1198},{"class":"stormcaller","id":15,"injury":0,"level":31,"name":"Ylva","runbook":{"rules":[{"do":{"a":"skill","skill":"chain_lightning"},"target":null,"when":[{"c":"enemies_at_least","n":3}]},{"do":{"a":"skill","skill":"thunderclap"},"target":"lowest_hp_pct","when":[{"c":"always"}]}],"v":1},"slots":{"armour":65,"charm":88,"helm":13,"weapon":47},"thread":false,"xp":974},{"class":"hearthkeeper","id":20,"injury":0,"level":26,"name":"Ragna","runbook":{"rules":[{"do":{"a":"skill","skill":"hearth_light"},"target":"lowest_hp_pct","when":[{"c":"ally_hp_below","pct":60}]},{"do":{"a":"skill","skill":"warm_embers"},"target":null,"when":[{"c":"ally_lacks","status":"mend"}]}],"v":1},"slots":{"armour":17,"charm":19,"helm":55,"weapon":49},"thread":false,"xp":2},{"class":"draugr_knight","id":32,"injury":0,"level":26,"name":"Hakon","runbook":{"rules":[{"do":{"a":"skill","skill":"undying_will"},"target":null,"when":[{"c":"self_hp_below","pct":50}]},{"do":{"a":"skill","skill":"cold_grip"},"target":"lowest_hp_pct","when":[{"c":"always"}]}],"v":1},"slots":{"armour":42,"charm":31,"helm":40,"weapon":28},"thread":false,"xp":960},{"class":"volva","id":61,"injury":0,"level":31,"name":"Vala","runbook":{"rules":[{"do":{"a":"skill","skill":"hex"},"target":"highest_hp","when":[{"c":"enemy_lacks","status":"mark"}]},{"do":{"a":"skill","skill":"frostbite"},"target":"lowest_hp_pct","when":[{"c":"always"}]}],"v":1},"slots":{"armour":86,"charm":60,"helm":157,"weapon":152},"thread":false,"xp":1243},{"class":"berserker","id":77,"injury":0,"level":30,"name":"Thora","runbook":{"rules":[{"do":{"a":"skill","skill":"frenzy"},"target":null,"when":[{"c":"self_lacks","status":"fury"}]},{"do":{"a":"skill","skill":"maul"},"target":"lowest_hp_pct","when":[{"c":"always"}]},{"do":{"a":"skill","skill":"rend"},"target":"lowest_hp_pct","when":[{"c":"always"}]}],"v":1},"slots":{"armour":162,"charm":149,"helm":148,"weapon":153},"thread":true,"xp":967},{"class":"valkyrie","id":180,"injury":0,"level":25,"name":"Brynja","runbook":{"rules":[{"do":{"a":"skill","skill":"wings_shield"},"target":null,"when":[{"c":"ally_lacks","status":"bulwark"}]},{"do":{"a":"skill","skill":"storm_rend"},"target":null,"when":[{"c":"enemies_at_least","n":3}]},{"do":{"a":"skill","skill":"choose_the_slain"},"target":"lowest_hp_pct","when":[{"c":"always"}]}],"v":1},"slots":{"armour":257,"charm":271,"helm":265,"weapon":268},"thread":false,"xp":111}],"items":[{"held":null,"heldStar":null,"id":8,"ilvl":1,"kind":null,"lines":[],"mulligan":1,"realm":"midgard","set":null,"slot":"helm","star":0,"tier":"plain"},{"held":null,"heldStar":null,"id":13,"ilvl":1,"kind":null,"lines":[],"mulligan":1,"realm":"asgard","set":null,"slot":"helm","star":0,"tier":"plain"},{"held":null,"heldStar":null,"id":17,"ilvl":1,"kind":null,"lines":[],"mulligan":1,"realm":"midgard","set":null,"slot":"armour","star":0,"tier":"plain"},{"held":null,"heldStar":null,"id":19,"ilvl":1,"kind":null,"lines":[],"mulligan":1,"realm":"midgard","set":null,"slot":"charm","star":0,"tier":"plain"},{"held":null,"heldStar":null,"id":25,"ilvl":1,"kind":null,"lines":[[6,232],[1,686]],"mulligan":1,"realm":"midgard","set":null,"slot":"armour","star":3,"tier":"runed"},{"held":null,"heldStar":null,"id":28,"ilvl":3,"kind":"MIT","lines":[],"mulligan":1,"realm":"helheim","set":null,"slot":"weapon","star":1,"tier":"plain"},{"held":null,"heldStar":null,"id":31,"ilvl":3,"kind":null,"lines":[],"mulligan":1,"realm":"helheim","set":null,"slot":"charm","star":0,"tier":"plain"},{"held":null,"heldStar":null,"id":40,"ilvl":3,"kind":null,"lines":[[6,351],[5,663]],"mulligan":1,"realm":"midgard","set":null,"slot":"helm","star":0,"tier":"runed"},{"held":null,"heldStar":null,"id":42,"ilvl":3,"kind":null,"lines":[[5,744],[4,502]],"mulligan":1,"realm":"midgard","set":null,"slot":"armour","star":0,"tier":"runed"},{"held":null,"heldStar":null,"id":43,"ilvl":3,"kind":"ARC","lines":[[0,962]],"mulligan":1,"realm":"midgard","set":null,"slot":"weapon","star":0,"tier":"fine"},{"held":null,"heldStar":null,"id":45,"ilvl":3,"kind":null,"lines":[[7,1338]],"mulligan":1,"realm":"midgard","set":null,"slot":"charm","star":0,"tier":"fine"},{"held":null,"heldStar":null,"id":47,"ilvl":4,"kind":"ARC","lines":[[2,538],[5,576],[9,602]],"mulligan":1,"realm":"midgard","set":null,"slot":"weapon","star":0,"tier":"heirloom"},{"held":null,"heldStar":null,"id":49,"ilvl":4,"kind":"ARC","lines":[[0,742],[2,479]],"mulligan":1,"realm":"midgard","set":null,"slot":"weapon","star":0,"tier":"runed"},{"held":null,"heldStar":null,"id":55,"ilvl":3,"kind":null,"lines":[[6,381],[2,1064]],"mulligan":1,"realm":"helheim","set":null,"slot":"helm","star":0,"tier":"runed"},{"held":null,"heldStar":null,"id":60,"ilvl":7,"kind":null,"lines":[],"mulligan":1,"realm":"helheim","set":null,"slot":"charm","star":0,"tier":"plain"},{"held":null,"heldStar":null,"id":65,"ilvl":6,"kind":null,"lines":[[6,138],[1,403],[4,982]],"mulligan":1,"realm":"midgard","set":"hearthforged","slot":"armour","star":4,"tier":"heirloom"},{"held":null,"heldStar":null,"id":72,"ilvl":6,"kind":null,"lines":[[0,537],[1,1143]],"mulligan":1,"realm":"midgard","set":"hearthforged","slot":"helm","star":0,"tier":"runed"},{"held":null,"heldStar":null,"id":86,"ilvl":8,"kind":null,"lines":[[3,1159],[6,189]],"mulligan":1,"realm":"midgard","set":"hearthforged","slot":"armour","star":5,"tier":"runed"},{"held":null,"heldStar":null,"id":88,"ilvl":8,"kind":null,"lines":[[7,1963],[2,501],[4,701]],"mulligan":1,"realm":"midgard","set":"hearthforged","slot":"charm","star":4,"tier":"heirloom"},{"held":null,"heldStar":null,"id":112,"ilvl":9,"kind":null,"lines":[[1,950],[6,111]],"mulligan":1,"realm":"midgard","set":"hearthforged","slot":"armour","star":4,"tier":"runed"},{"held":null,"heldStar":null,"id":148,"ilvl":8,"kind":null,"lines":[[3,1041]],"mulligan":1,"realm":"midgard","set":null,"slot":"helm","star":0,"tier":"fine"},{"held":null,"heldStar":null,"id":149,"ilvl":9,"kind":null,"lines":[[4,806],[0,780]],"mulligan":1,"realm":"midgard","set":"hearthforged","slot":"charm","star":0,"tier":"runed"},{"held":null,"heldStar":null,"id":152,"ilvl":9,"kind":"ARC","lines":[[2,515],[5,478]],"mulligan":1,"realm":"midgard","set":null,"slot":"weapon","star":0,"tier":"runed"},{"held":null,"heldStar":null,"id":153,"ilvl":9,"kind":"MIT","lines":[[9,1040],[6,110]],"mulligan":1,"realm":"midgard","set":null,"slot":"weapon","star":0,"tier":"runed"},{"held":null,"heldStar":null,"id":157,"ilvl":9,"kind":null,"lines":[],"mulligan":1,"realm":"midgard","set":null,"slot":"helm","star":0,"tier":"plain"},{"held":null,"heldStar":null,"id":159,"ilvl":9,"kind":null,"lines":[[0,1044]],"mulligan":1,"realm":"midgard","set":null,"slot":"charm","star":0,"tier":"fine"},{"held":null,"heldStar":null,"id":160,"ilvl":9,"kind":"ARC","lines":[[1,828]],"mulligan":1,"realm":"midgard","set":null,"slot":"weapon","star":0,"tier":"fine"},{"held":null,"heldStar":null,"id":162,"ilvl":9,"kind":null,"lines":[[3,758],[5,742],[0,1046]],"mulligan":1,"realm":"midgard","set":null,"slot":"armour","star":0,"tier":"heirloom"},{"held":null,"heldStar":null,"id":176,"ilvl":18,"kind":"MIT","lines":[],"mulligan":1,"realm":"asgard","set":null,"slot":"weapon","star":3,"tier":"plain"},{"held":null,"heldStar":null,"id":177,"ilvl":18,"kind":null,"lines":[],"mulligan":1,"realm":"asgard","set":null,"slot":"armour","star":0,"tier":"plain"},{"held":null,"heldStar":null,"id":178,"ilvl":18,"kind":null,"lines":[],"mulligan":1,"realm":"asgard","set":null,"slot":"helm","star":0,"tier":"plain"},{"held":null,"heldStar":null,"id":179,"ilvl":18,"kind":null,"lines":[],"mulligan":1,"realm":"asgard","set":null,"slot":"charm","star":0,"tier":"plain"},{"held":null,"heldStar":null,"id":240,"ilvl":12,"kind":null,"lines":[],"mulligan":1,"realm":"midgard","set":null,"slot":"helm","star":0,"tier":"plain"},{"held":null,"heldStar":null,"id":241,"ilvl":12,"kind":null,"lines":[[8,453],[1,1178]],"mulligan":1,"realm":"midgard","set":null,"slot":"charm","star":0,"tier":"runed"},{"held":null,"heldStar":null,"id":242,"ilvl":10,"kind":null,"lines":[[9,616]],"mulligan":1,"realm":"helheim","set":null,"slot":"helm","star":0,"tier":"fine"},{"held":null,"heldStar":null,"id":243,"ilvl":10,"kind":"ARC","lines":[[3,1181]],"mulligan":1,"realm":"helheim","set":null,"slot":"weapon","star":0,"tier":"fine"},{"held":null,"heldStar":null,"id":244,"ilvl":10,"kind":null,"lines":[[3,945],[6,249]],"mulligan":1,"realm":"helheim","set":null,"slot":"helm","star":0,"tier":"runed"},{"held":null,"heldStar":null,"id":245,"ilvl":10,"kind":null,"lines":[[9,524]],"mulligan":1,"realm":"helheim","set":null,"slot":"helm","star":0,"tier":"fine"},{"held":null,"heldStar":null,"id":246,"ilvl":10,"kind":null,"lines":[],"mulligan":1,"realm":"helheim","set":null,"slot":"armour","star":0,"tier":"plain"},{"held":null,"heldStar":null,"id":247,"ilvl":10,"kind":null,"lines":[[6,141],[9,1004]],"mulligan":1,"realm":"helheim","set":"grave_shroud","slot":"charm","star":0,"tier":"runed"},{"held":null,"heldStar":null,"id":248,"ilvl":10,"kind":null,"lines":[[5,462]],"mulligan":1,"realm":"helheim","set":null,"slot":"helm","star":0,"tier":"fine"},{"held":null,"heldStar":null,"id":249,"ilvl":10,"kind":null,"lines":[],"mulligan":1,"real